_MEMBER_MyList,_LogP_MyList,GO,_PATTERN_,_RANK_,GiniIndex,Category,CategoryID,Description,PARENT_GO,LogP,Enrichment,Z-score,#TotalGeneInLibrary,#GeneInGO,#GeneInHitList,#GeneInGOAndHitList,%InGO,STDV %InGO,GeneID,Hits,Log(q-value),EvidenceCutoff
1,-3,M41697,M1,1,0,Cell Type Signatures,7,TRAVAGLINI LUNG EREG DENDRITIC CELL,,-3,8.7,5.3,30286,579,24,4,17,7.6,308|3556|5925|9589,ANXA5|IL1RAP|RB1|WTAP,-0.05,0
1,-2.8,M41679,M1,1,0,Cell Type Signatures,7,TRAVAGLINI LUNG MESOTHELIAL CELL,,-2.8,7.8,4.9,30286,649,24,4,17,7.6,1666|3487|3556|23531,DECR1|IGFBP4|IL1RAP|MMD,0,0
1,-2.7,M39074,M1,1,0,Cell Type Signatures,7,ZHONG PFC MAJOR TYPES ASTROCYTES,,-2.7,12,5.4,30286,325,24,3,12,6.8,308|3487|8404,ANXA5|IGFBP4|SPARCL1,0,0
1,-2.5,M39176,M1,1,0,Cell Type Signatures,7,MURARO PANCREAS ENDOTHELIAL CELL,,-2.5,10,5.1,30286,362,24,3,12,6.8,3487|5925|8404,IGFBP4|RB1|SPARCL1,0,0
1,-2.5,M41711,M1,1,0,Cell Type Signatures,7,FAN OVARY CL9 PUTATIVE APOPTOTIC ENDOTHELIAL CELL,,-2.5,10,5.1,30286,365,24,3,12,6.8,308|8404|9589,ANXA5|SPARCL1|WTAP,0,0
1,-1.8,M39175,M1,1,0,Cell Type Signatures,7,MURARO PANCREAS MESENCHYMAL STROMAL CELL,,-1.8,5.6,3.4,30286,680,24,3,12,6.8,308|3487|3690,ANXA5|IGFBP4|ITGB3,0,0
1,-1.7,M41700,M1,1,0,Cell Type Signatures,7,TRAVAGLINI LUNG OLR1 CLASSICAL MONOCYTE CELL,,-1.7,5.2,3.2,30286,726,24,3,12,6.8,308|3556|9589,ANXA5|IL1RAP|WTAP,0,0
1,-1.6,M39050,M1,1,0,Cell Type Signatures,7,MANNO MIDBRAIN NEUROTYPES HPERIC,,-1.6,4.8,3,30286,795,24,3,12,6.8,308|3487|8404,ANXA5|IGFBP4|SPARCL1,0,0
